{
  "schema": "drillbalancer.meta/1",
  "taxonomy_version": 1,
  "recording_id": "20261026T144505Z_synt_0905",
  "session_id": "20261026T1428_synt",
  "start_utc": "2026-10-26T14:45:05Z",
  "device_t0_us": 3242633,
  "duration_s": 4.837,
  "device": {
    "board": "waveshare-esp32-s3-touch-amoled-1.75",
    "fw_version": "0.1.0",
    "fw_git": "6afcec4-dirty",
    "board_id": "ead705e2"
  },
  "app": {
    "version": "1.0.0",
    "tool": "dbdata.synth"
  },
  "imu": {
    "chip": "QMI8658",
    "profile": "RAW448",
    "odr_nominal_hz": 448.4,
    "odr_measured_hz": 448.391,
    "accel_range_g": 4,
    "gyro_range_dps": 512,
    "accel_lsb_per_g": 8192,
    "gyro_lsb_per_dps": 64,
    "accel_lpf": "off",
    "gyro_lpf": "off",
    "frame": "board: X right, Y up the screen, Z out of the screen; bit along -Z",
    "axis_map": "x=+cx,y=+cy,z=+cz",
    "accel_cal": {
      "valid": false,
      "bias_g": [
        0,
        0,
        0
      ],
      "scale": [
        1,
        1,
        1
      ]
    },
    "mount": {
      "valid": false,
      "drill_axis": [
        0,
        0,
        -1
      ]
    },
    "gyro_bias_rad_s": [
      2.08396104426356e-05,
      -3.680377631098963e-05,
      -9.45549618336372e-05
    ],
    "registers": {
      "ctrl2": 20,
      "ctrl3": 84,
      "ctrl5": 0
    }
  },
  "take": {
    "take_id": 1,
    "end_reason": "user",
    "stats": {
      "ring_high_water_pct": 0.24,
      "dropped_records": 0,
      "dropped_bytes": 0,
      "audio_overflows": 0,
      "battery_pct_start": 80,
      "battery_pct_end": 80
    }
  },
  "audio": {
    "codec": "flac",
    "file": "audio.flac",
    "rate_nominal_hz": 16000,
    "rate_measured_hz": 16000.0,
    "bits": 16,
    "channels": [
      "mic1"
    ],
    "adc": "ES7210",
    "gain_db": 6,
    "muted_spans_us": [],
    "clipped_frac": 0.0,
    "block_frames": 256
  },
  "sync": {
    "method": "esp_timer@dma_block",
    "fit": "t_us = a + b*frame",
    "a_us": 3242687.5,
    "b_us_per_frame": 62.5,
    "residual_rms_us": 0.0
  },
  "gaps": {
    "imu_filled_samples": 259,
    "imu_missing_samples": 0,
    "transport_gaps": [],
    "audio_missing_frames": 0,
    "audio_gap_frames": []
  },
  "level": {
    "mode": "wall",
    "target_deg": 45.0,
    "tol_deg": 0.5,
    "near_deg": 2.0
  },
  "session": {
    "material": "wood/softwood",
    "layers": [],
    "mode": "drill",
    "bit": {
      "type": "brad_point",
      "diameter_mm": 8.0
    },
    "drill": {
      "type": "drill",
      "motor": "brushless",
      "model": "dbsim",
      "gear": 2,
      "speed_setting": null
    },
    "outcome_tags": [],
    "notes": "synthetic: fx_pulled_open"
  },
  "derived": {
    "orientation": "wall",
    "off_angle_deg": 0.08,
    "tags": []
  },
  "review": {
    "status": "reviewed",
    "detector": "truth",
    "revision": 1,
    "edited_events": 0,
    "reviewer": null
  },
  "quality": {
    "flags": []
  },
  "files": {
    "audio.flac": {
      "sha256": "cc7e2681d7908f67d1125471ff348b478dec7b68b9b74af392b45e2bd2f42415",
      "bytes": 101256
    },
    "audio_sync.csv": {
      "sha256": "359ef6078ff7f9956b37ebde1a972c3299db2159ca6720e07852ba27de27aba2",
      "bytes": 4195
    },
    "device_events.csv": {
      "sha256": "40e4babfed8132bf63cae4a414c3354ae815b67cf50ae25028ace96dda00ffc8",
      "bytes": 59
    },
    "imu.csv.gz": {
      "sha256": "67ce684561a935822605a68f731f43d488b7393fa585a9542a11e1fb08a5c864",
      "bytes": 36063
    },
    "level.csv.gz": {
      "sha256": "774546b34e44d40bd45b705035abd3003c93b44fc9676421b044427ef1b0f3df",
      "bytes": 565
    }
  }
}
